{
  "metadata": {
    "schema_version": "2.0",
    "content_version": "1.0",
    "revision": 1,
    "generated_by": {
      "type": "ai",
      "provider": "deepseek",
      "model": "deepseek-chat"
    }
  },
  "episode_id": "travel_new_york_city_ep001",
  "scene_id": "S008",
  "shot_id": "SHOT_001",
  "character_states": [
    {
      "character_ref": "CHAR_JIEUN_001",
      "identity_lock": true,
      "appearance": [
        "Oval face with soft features",
        "Natural eyebrows",
        "Dark brown eyes",
        "Light natural makeup",
        "Warm friendly expression",
        "Average height, slim build"
      ],
      "hair": [
        "Shoulder-length dark brown hair",
        "Straight with slight natural waves",
        "Tucked behind ears"
      ],
      "clothing": [
        "White casual t-shirt",
        "Light blue denim jacket",
        "Dark blue skinny jeans",
        "White sneakers",
        "Small silver earrings",
        "Simple wristwatch"
      ],
      "carried_items": [
        "Medium-sized travel backpack",
        "Small crossbody bag",
        "Smartphone",
        "Passport",
        "Checked suitcase"
      ],
      "body_state": [
        "Seated by the window on the AirTrain",
        "Backpack worn on back",
        "Crossbody bag worn across body",
        "Suitcase placed beside her seat"
      ],
      "emotion": "confident and excited"
    }
  ],
  "location_state": {
    "location_ref": "LOC_AIRPORT_TRANSIT_001",
    "identity_lock": true,
    "persistent_features": [
      "Transit station platforms",
      "Train or vehicle interior",
      "Views of urban landscape during the journey",
      "Signage for transit lines and stops"
    ],
    "current_zone": "AirTrain car interior, seated by the window",
    "orientation_state": [
      "Jieun seated by the window",
      "Suitcase placed beside her seat",
      "Window beside Jieun showing the passing landscape",
      "Train car aisle visible beyond her seat",
      "Other passengers seated or standing in the car"
    ]
  },
  "prop_states": [
    {
      "prop_id": "PROP_BACKPACK_001",
      "owner_ref": "CHAR_JIEUN_001",
      "state": "worn on back",
      "position": "on Jieun's back",
      "visible": true,
      "continuity_lock": true
    },
    {
      "prop_id": "PROP_CROSSBODY_BAG_001",
      "owner_ref": "CHAR_JIEUN_001",
      "state": "worn across body",
      "position": "across Jieun's body",
      "visible": true,
      "continuity_lock": true
    },
    {
      "prop_id": "PROP_SMARTPHONE_001",
      "owner_ref": "CHAR_JIEUN_001",
      "state": "not visible in hands, likely stored in crossbody bag or pocket",
      "position": "not visible, likely in crossbody bag or pocket",
      "visible": false,
      "continuity_lock": true
    },
    {
      "prop_id": "PROP_PASSPORT_001",
      "owner_ref": "CHAR_JIEUN_001",
      "state": "not visible in hands, likely stored in crossbody bag or pocket",
      "position": "not visible, likely in crossbody bag or pocket",
      "visible": false,
      "continuity_lock": true
    },
    {
      "prop_id": "PROP_LUGGAGE_001",
      "owner_ref": "CHAR_JIEUN_001",
      "state": "placed beside Jieun's seat",
      "position": "beside Jieun's seat on the AirTrain",
      "visible": true,
      "continuity_lock": true
    }
  ],
  "environment_state": {
    "time_of_day": "day",
    "weather": null,
    "lighting": "bright natural daylight coming through the train windows, with soft interior lighting",
    "crowd_state": "a few other passengers seated or standing in the AirTrain car, some looking at phones or out the windows"
  },
  "story_visual_state": {
    "resolved_visual_facts": [
      "Jieun's plane has landed at JFK Airport",
      "Jieun has disembarked from the airplane",
      "Jieun has arrived at the immigration area inside the JFK terminal",
      "Jieun has approached the airport employee to ask for help",
      "Jieun has been told that no forms are needed and to have her passport ready",
      "Jieun has taken her passport out from her crossbody bag",
      "Jieun has joined the correct immigration line on the left",
      "Jieun has reached the immigration officer's booth",
      "Jieun has handed her passport to the immigration officer",
      "The immigration officer has reviewed Jieun's passport",
      "Jieun has answered the officer's questions about the purpose of her visit, how long she will stay, and where she will stay in New York",
      "The immigration officer has returned Jieun's passport",
      "The immigration officer has welcomed Jieun to New York",
      "Jieun has been cleared to enter the United States",
      "Jieun has taken back her passport from the immigration officer",
      "Jieun has nodded gratefully to the immigration officer",
      "Jieun has stepped away from the immigration booth",
      "Jieun has walked into the baggage claim area",
      "Jieun has checked the digital flight information display",
      "Jieun has identified the correct carousel number for flight KE081",
      "Jieun has walked to the correct baggage carousel",
      "Jieun has spotted her suitcase on the baggage carousel",
      "Jieun has retrieved her suitcase from the carousel",
      "Jieun is now holding her retrieved suitcase",
      "Jieun has approached the airport employee and asked for directions to ground transportation",
      "The airport employee has pointed toward the ground transportation signs and given directions to Jieun",
      "Jieun has looked in the direction the employee pointed",
      "Jieun has nodded in understanding",
      "Jieun has walked into the ground transportation area",
      "Jieun has stopped near the ground transportation signs",
      "Jieun has looked at the taxi sign",
      "Jieun has looked at the ride-sharing sign",
      "Jieun has looked toward the public transit sign",
      "Jieun has glanced down at her suitcase",
      "Jieun has looked back up at the signs with a thoughtful, unsure expression",
      "Jieun has walked toward the transit employee",
      "Jieun has stopped in front of the transit employee",
      "Jieun is now standing in front of the transit employee",
      "The transit employee is facing Jieun, ready to respond",
      "The transit employee has explained the transportation options to Jieun",
      "The transit employee has pointed toward the train signs",
      "Jieun has looked toward the train signs",
      "Jieun has nodded and said she will take the train",
      "Jieun has decided to take public transit to Manhattan",
      "Jieun has begun walking toward the train signs",
      "Jieun has boarded the AirTrain",
      "Jieun has found a seat by the window on the AirTrain",
      "Jieun has placed her suitcase beside her seat"
    ],
    "unresolved_visual_facts": [
      "Jieun has not yet reached her hotel in Manhattan",
      "Jieun has not yet arrived at the subway connection"
    ],
    "must_remain_visible": [
      "Jieun's travel backpack on her back",
      "Jieun's crossbody bag across her body",
      "Jieun's suitcase beside her seat",
      "Jieun seated by the window on the AirTrain"
    ],
    "must_not_appear": [
      "Jieun arriving in Manhattan",
      "Jieun leaving the AirTrain",
      "Jieun's suitcase being lost or missing",
      "Jieun's passport or smartphone being dropped or lost",
      "Any problems or issues with the AirTrain"
    ]
  },
  "continuity_links": {
    "previous_scene_id": "S007",
    "previous_shot_id": "SHOT_003",
    "next_scene_id": "S008",
    "next_shot_id": "SHOT_002",
    "carry_in": [
      "Jieun has received advice from a transit employee.",
      "She has decided to take public transit to Manhattan.",
      "She is now heading toward the transit station.",
      "She is walking in the direction of the train signs, holding her suitcase handle."
    ],
    "carry_out": [
      "Jieun is seated by the window on the AirTrain.",
      "Her suitcase is placed beside her seat.",
      "She is looking out the window as the train moves."
    ]
  },
  "locks": {
    "character_identity": true,
    "clothing": true,
    "location_identity": true,
    "prop_state": true,
    "timeline": true,
    "weather": true,
    "story_state": true
  }
}