{
  "metadata": {
    "schema_version": "2.0",
    "content_version": "1.0",
    "revision": 1,
    "generated_by": {
      "type": "ai",
      "provider": "deepseek",
      "model": "deepseek-chat"
    }
  },
  "episode_id": "travel_new_york_city_ep001",
  "scene_id": "S005",
  "shot_id": "SHOT_001",
  "character_states": [
    {
      "character_ref": "CHAR_JIEUN_001",
      "identity_lock": true,
      "appearance": [
        "Oval face with soft features",
        "Natural eyebrows",
        "Dark brown eyes",
        "Light natural makeup",
        "Warm friendly expression",
        "Average height, slim build"
      ],
      "hair": [
        "Shoulder-length dark brown hair",
        "Straight with slight natural waves",
        "Tucked behind ears"
      ],
      "clothing": [
        "White casual t-shirt",
        "Light blue denim jacket",
        "Dark blue skinny jeans",
        "White sneakers",
        "Small silver earrings",
        "Simple wristwatch"
      ],
      "carried_items": [
        "Medium-sized travel backpack",
        "Small crossbody bag",
        "Smartphone",
        "Passport"
      ],
      "body_state": [
        "Standing in front of the baggage carousel",
        "Backpack worn on back",
        "Crossbody bag worn across body",
        "Holding her retrieved suitcase with both hands",
        "Smartphone and passport no longer in hands, likely stored in crossbody bag or pockets"
      ],
      "emotion": "relieved"
    }
  ],
  "location_state": {
    "location_ref": "LOC_JFK_AIRPORT_001",
    "identity_lock": true,
    "persistent_features": [
      "Large terminal with high ceilings",
      "Digital flight information displays",
      "Signage for Arrivals, Immigration, and Baggage Claim",
      "Moving walkways and escalators",
      "Large windows with natural light"
    ],
    "current_zone": "baggage claim area, in front of the baggage carousel for flight KE081, JFK International Airport",
    "orientation_state": [
      "Jieun standing in front of the baggage carousel, facing the carousel belt",
      "Baggage carousel directly in front of Jieun",
      "Jieun's retrieved suitcase held in front of her, between her and the carousel",
      "Digital flight information display behind Jieun",
      "Other passengers standing around the same carousel",
      "Signage for baggage claim visible above the carousel"
    ]
  },
  "prop_states": [
    {
      "prop_id": "PROP_BACKPACK_001",
      "owner_ref": "CHAR_JIEUN_001",
      "state": "worn on back",
      "position": "on Jieun's back",
      "visible": true,
      "continuity_lock": true
    },
    {
      "prop_id": "PROP_CROSSBODY_BAG_001",
      "owner_ref": "CHAR_JIEUN_001",
      "state": "worn across body",
      "position": "across Jieun's body",
      "visible": true,
      "continuity_lock": true
    },
    {
      "prop_id": "PROP_SMARTPHONE_001",
      "owner_ref": "CHAR_JIEUN_001",
      "state": "not visible in hands, likely stored in crossbody bag or pocket",
      "position": "not visible, likely in crossbody bag or pocket",
      "visible": false,
      "continuity_lock": true
    },
    {
      "prop_id": "PROP_PASSPORT_001",
      "owner_ref": "CHAR_JIEUN_001",
      "state": "not visible in hands, likely stored in crossbody bag or pocket",
      "position": "not visible, likely in crossbody bag or pocket",
      "visible": false,
      "continuity_lock": true
    },
    {
      "prop_id": "PROP_LUGGAGE_001",
      "owner_ref": "CHAR_JIEUN_001",
      "state": "retrieved from carousel, held by Jieun",
      "position": "in Jieun's hands, in front of her",
      "visible": true,
      "continuity_lock": true
    }
  ],
  "environment_state": {
    "time_of_day": "day",
    "weather": null,
    "lighting": "bright indoor terminal lighting with natural light from large windows",
    "crowd_state": "other passengers collecting luggage from the carousel, luggage carts being pushed by arriving travelers"
  },
  "story_visual_state": {
    "resolved_visual_facts": [
      "Jieun's plane has landed at JFK Airport",
      "Jieun has disembarked from the airplane",
      "Jieun has arrived at the immigration area inside the JFK terminal",
      "Jieun has approached the airport employee to ask for help",
      "The airport employee has pointed toward the line on the left for visitors",
      "Jieun has been told that no forms are needed and to have her passport ready",
      "Jieun has taken her passport out from her crossbody bag",
      "Jieun has joined the correct immigration line on the left",
      "Jieun has reached the immigration officer's booth",
      "Jieun has handed her passport to the immigration officer",
      "The immigration officer has reviewed Jieun's passport",
      "Jieun has answered the officer's questions about the purpose of her visit, how long she will stay, and where she will stay in New York",
      "The immigration officer has returned Jieun's passport",
      "The immigration officer has welcomed Jieun to New York",
      "Jieun has been cleared to enter the United States",
      "Jieun has taken back her passport from the immigration officer",
      "Jieun has nodded gratefully to the immigration officer",
      "Jieun has stepped away from the immigration booth",
      "Jieun has walked into the baggage claim area",
      "Jieun has checked the digital flight information display",
      "Jieun has identified the correct carousel number for flight KE081",
      "Jieun has walked to the correct baggage carousel",
      "Jieun has spotted her suitcase on the baggage carousel",
      "Jieun has retrieved her suitcase from the carousel",
      "Jieun is now holding her retrieved suitcase"
    ],
    "unresolved_visual_facts": [
      "Jieun has not yet reached her hotel in Manhattan",
      "Jieun has not yet found the ground transportation area"
    ],
    "must_remain_visible": [
      "Jieun's travel backpack on her back",
      "Jieun's crossbody bag across her body",
      "Jieun's retrieved suitcase in her hands"
    ],
    "must_not_appear": [
      "Jieun leaving the baggage claim area",
      "Jieun's suitcase being lost or missing",
      "Jieun's passport or smartphone being dropped or lost"
    ]
  },
  "continuity_links": {
    "previous_scene_id": "S004",
    "previous_shot_id": "SHOT_002",
    "next_scene_id": "S005",
    "next_shot_id": "SHOT_002",
    "carry_in": [
      "Jieun has found the correct baggage carousel",
      "She is waiting for her luggage to arrive",
      "She hopes her bag made it onto the flight"
    ],
    "carry_out": [
      "Jieun has retrieved her luggage from the carousel",
      "She is holding her suitcase",
      "She is relieved that her luggage arrived"
    ]
  },
  "locks": {
    "character_identity": true,
    "clothing": true,
    "location_identity": true,
    "prop_state": true,
    "timeline": true,
    "weather": true,
    "story_state": true
  }
}